Gene	Gene synonym	Ensembl	Gene description	Uniprot	Chromosome	Position	Protein class	Biological process	Molecular function	Disease involvement	Evidence	HPA evidence	UniProt evidence	NeXtProt evidence	MS evidence	RNA tissue specificity	RNA tissue distribution	RNA tissue specificity score	RNA tissue specific NX	RNA single cell type specificity	RNA single cell type distribution	RNA single cell type specificity score	RNA single cell type specific NX	RNA cancer specificity	RNA cancer distribution	RNA cancer specificity score	RNA cancer specific FPKM	RNA brain regional specificity	RNA brain regional distribution	RNA brain regional specificity score	RNA brain regional specific NX	RNA blood cell specificity	RNA blood cell distribution	RNA blood cell specificity score	RNA blood cell specific NX	RNA blood lineage specificity	RNA blood lineage distribution	RNA blood lineage specificity score	RNA blood lineage specific NX	RNA cell line specificity	RNA cell line distribution	RNA cell line specificity score	RNA cell line specific NX	RNA mouse brain regional specificity	RNA mouse brain regional distribution	RNA mouse brain regional specificity score	RNA mouse brain regional specific pTPM	RNA pig brain regional specificity	RNA pig brain regional distribution	RNA pig brain regional specificity score	RNA pig brain regional specific pTPM	Antibody	Reliability (IH)	Reliability (Mouse Brain)	Reliability (IF)	Subcellular location	Secretome location	CCD Protein	CCD Transcript	Blood concentration - Conc. blood IM [pg/L]	Blood concentration - Conc. blood MS [pg/L]	Subcellular main location	Subcellular additional location	Antibody RRID	Pathology prognostics - Breast cancer	Pathology prognostics - Cervical cancer	Pathology prognostics - Colorectal cancer	Pathology prognostics - Endometrial cancer	Pathology prognostics - Glioma	Pathology prognostics - Head and neck cancer	Pathology prognostics - Liver cancer	Pathology prognostics - Lung cancer	Pathology prognostics - Melanoma	Pathology prognostics - Ovarian cancer	Pathology prognostics - Pancreatic cancer	Pathology prognostics - Prostate cancer	Pathology prognostics - Renal cancer	Pathology prognostics - Stomach cancer	Pathology prognostics - Testis cancer	Pathology prognostics - Thyroid cancer	Pathology prognostics - Urothelial cancer	Tissue RNA - adipose tissue [NX]	Tissue RNA - adrenal gland [NX]	Tissue RNA - amygdala [NX]	Tissue RNA - appendix [NX]	Tissue RNA - basal ganglia [NX]	Tissue RNA - bone marrow [NX]	Tissue RNA - breast [NX]	Tissue RNA - cerebellum [NX]	Tissue RNA - cerebral cortex [NX]	Tissue RNA - cervix, uterine [NX]	Tissue RNA - colon [NX]	Tissue RNA - corpus callosum [NX]	Tissue RNA - ductus deferens [NX]	Tissue RNA - duodenum [NX]	Tissue RNA - endometrium 1 [NX]	Tissue RNA - epididymis [NX]	Tissue RNA - esophagus [NX]	Tissue RNA - fallopian tube [NX]	Tissue RNA - gallbladder [NX]	Tissue RNA - heart muscle [NX]	Tissue RNA - hippocampal formation [NX]	Tissue RNA - hypothalamus [NX]	Tissue RNA - kidney [NX]	Tissue RNA - liver [NX]	Tissue RNA - lung [NX]	Tissue RNA - lymph node [NX]	Tissue RNA - midbrain [NX]	Tissue RNA - olfactory region [NX]	Tissue RNA - ovary [NX]	Tissue RNA - pancreas [NX]	Tissue RNA - parathyroid gland [NX]	Tissue RNA - pituitary gland [NX]	Tissue RNA - placenta [NX]	Tissue RNA - pons and medulla [NX]	Tissue RNA - prostate [NX]	Tissue RNA - rectum [NX]	Tissue RNA - retina [NX]	Tissue RNA - salivary gland [NX]	Tissue RNA - seminal vesicle [NX]	Tissue RNA - skeletal muscle [NX]	Tissue RNA - skin 1 [NX]	Tissue RNA - small intestine [NX]	Tissue RNA - smooth muscle [NX]	Tissue RNA - spinal cord [NX]	Tissue RNA - spleen [NX]	Tissue RNA - stomach 1 [NX]	Tissue RNA - testis [NX]	Tissue RNA - thalamus [NX]	Tissue RNA - thymus [NX]	Tissue RNA - thyroid gland [NX]	Tissue RNA - tongue [NX]	Tissue RNA - tonsil [NX]	Tissue RNA - urinary bladder [NX]	Tissue RNA - vagina [NX]	Tissue RNA - B-cells [NX]	Tissue RNA - dendritic cells [NX]	Tissue RNA - granulocytes [NX]	Tissue RNA - monocytes [NX]	Tissue RNA - NK-cells [NX]	Tissue RNA - T-cells [NX]	Tissue RNA - total PBMC [NX]	Cell RNA - A-431 [NX]	Cell RNA - A549 [NX]	Cell RNA - AF22 [NX]	Cell RNA - AN3-CA [NX]	Cell RNA - ASC diff [NX]	Cell RNA - ASC TERT1 [NX]	Cell RNA - BEWO [NX]	Cell RNA - BJ [NX]	Cell RNA - BJ hTERT+ [NX]	Cell RNA - BJ hTERT+ SV40 Large T+ [NX]	Cell RNA - BJ hTERT+ SV40 Large T+ RasG12V [NX]	Cell RNA - CACO-2 [NX]	Cell RNA - CAPAN-2 [NX]	Cell RNA - Daudi [NX]	Cell RNA - EFO-21 [NX]	Cell RNA - fHDF/TERT166 [NX]	Cell RNA - GAMG [NX]	Cell RNA - HaCaT [NX]	Cell RNA - HAP1 [NX]	Cell RNA - HBEC3-KT [NX]	Cell RNA - HBF TERT88 [NX]	Cell RNA - HDLM-2 [NX]	Cell RNA - HEK 293 [NX]	Cell RNA - HEL [NX]	Cell RNA - HeLa [NX]	Cell RNA - Hep G2 [NX]	Cell RNA - HHSteC [NX]	Cell RNA - HL-60 [NX]	Cell RNA - HMC-1 [NX]	Cell RNA - HSkMC [NX]	Cell RNA - hTCEpi [NX]	Cell RNA - hTEC/SVTERT24-B [NX]	Cell RNA - hTERT-HME1 [NX]	Cell RNA - hTERT-RPE1 [NX]	Cell RNA - HUVEC TERT2 [NX]	Cell RNA - JURKAT [NX]	Cell RNA - K-562 [NX]	Cell RNA - Karpas-707 [NX]	Cell RNA - LHCN-M2 [NX]	Cell RNA - MCF7 [NX]	Cell RNA - MOLT-4 [NX]	Cell RNA - NB-4 [NX]	Cell RNA - NTERA-2 [NX]	Cell RNA - OE19 [NX]	Cell RNA - PC-3 [NX]	Cell RNA - REH [NX]	Cell RNA - RH-30 [NX]	Cell RNA - RPMI-8226 [NX]	Cell RNA - RPTEC TERT1 [NX]	Cell RNA - RT4 [NX]	Cell RNA - SCLC-21H [NX]	Cell RNA - SH-SY5Y [NX]	Cell RNA - SiHa [NX]	Cell RNA - SK-BR-3 [NX]	Cell RNA - SK-MEL-30 [NX]	Cell RNA - SuSa [NX]	Cell RNA - T-47d [NX]	Cell RNA - THP-1 [NX]	Cell RNA - TIME [NX]	Cell RNA - U-138 MG [NX]	Cell RNA - U-2 OS [NX]	Cell RNA - U-2197 [NX]	Cell RNA - U-251 MG [NX]	Cell RNA - U-266/70 [NX]	Cell RNA - U-266/84 [NX]	Cell RNA - U-698 [NX]	Cell RNA - U-87 MG [NX]	Cell RNA - U-937 [NX]	Cell RNA - WM-115 [NX]	Blood RNA - basophil [NX]	Blood RNA - classical monocyte [NX]	Blood RNA - eosinophil [NX]	Blood RNA - gdT-cell [NX]	Blood RNA - intermediate monocyte [NX]	Blood RNA - MAIT T-cell [NX]	Blood RNA - memory B-cell [NX]	Blood RNA - memory CD4 T-cell [NX]	Blood RNA - memory CD8 T-cell [NX]	Blood RNA - myeloid DC [NX]	Blood RNA - naive B-cell [NX]	Blood RNA - naive CD4 T-cell [NX]	Blood RNA - naive CD8 T-cell [NX]	Blood RNA - neutrophil [NX]	Blood RNA - NK-cell [NX]	Blood RNA - non-classical monocyte [NX]	Blood RNA - plasmacytoid DC [NX]	Blood RNA - T-reg [NX]	Blood RNA - total PBMC [NX]	Brain RNA - amygdala [NX]	Brain RNA - basal ganglia [NX]	Brain RNA - cerebellum [NX]	Brain RNA - cerebral cortex [NX]	Brain RNA - hippocampal formation [NX]	Brain RNA - hypothalamus [NX]	Brain RNA - midbrain [NX]	Brain RNA - olfactory region [NX]	Brain RNA - pons and medulla [NX]	Brain RNA - thalamus [NX]	Single Cell Type RNA - Alveolar cells type 1 [NX]	Single Cell Type RNA - Alveolar cells type 2 [NX]	Single Cell Type RNA - B-cells [NX]	Single Cell Type RNA - Basal glandular cells [NX]	Single Cell Type RNA - Basal keratinocytes [NX]	Single Cell Type RNA - Bipolar cells [NX]	Single Cell Type RNA - Cardiomyocytes [NX]	Single Cell Type RNA - Cholangiocytes [NX]	Single Cell Type RNA - Ciliated cells [NX]	Single Cell Type RNA - Club cells [NX]	Single Cell Type RNA - Collecting duct cells [NX]	Single Cell Type RNA - Cone photoreceptor cells [NX]	Single Cell Type RNA - Cytotrophoblasts [NX]	Single Cell Type RNA - Distal tubular cells [NX]	Single Cell Type RNA - Ductal cells [NX]	Single Cell Type RNA - Early spermatids [NX]	Single Cell Type RNA - Endothelial cells [NX]	Single Cell Type RNA - Enterocytes [NX]	Single Cell Type RNA - Erythroid cells [NX]	Single Cell Type RNA - Exocrine glandular cells [NX]	Single Cell Type RNA - Extravillous trophoblasts [NX]	Single Cell Type RNA - Fibroblasts [NX]	Single Cell Type RNA - Glandular cells [NX]	Single Cell Type RNA - granulocytes [NX]	Single Cell Type RNA - Hepatocytes [NX]	Single Cell Type RNA - Hofbauer cells [NX]	Single Cell Type RNA - Horizontal cells [NX]	Single Cell Type RNA - Intestinal endocrine cells [NX]	Single Cell Type RNA - Ito cells [NX]	Single Cell Type RNA - Kupffer cells [NX]	Single Cell Type RNA - Late spermatids [NX]	Single Cell Type RNA - Leydig cells [NX]	Single Cell Type RNA - Macrophages [NX]	Single Cell Type RNA - Melanocytes [NX]	Single Cell Type RNA - monocytes [NX]	Single Cell Type RNA - Mucus-secreting cells [NX]	Single Cell Type RNA - Muller glia cells [NX]	Single Cell Type RNA - Pancreatic endocrine cells [NX]	Single Cell Type RNA - Paneth cells [NX]	Single Cell Type RNA - Peritubular cells [NX]	Single Cell Type RNA - Proximal tubular cells [NX]	Single Cell Type RNA - Rod photoreceptor cells [NX]	Single Cell Type RNA - Sertoli cells [NX]	Single Cell Type RNA - Smooth muscle cells [NX]	Single Cell Type RNA - Spermatocytes [NX]	Single Cell Type RNA - Spermatogonia [NX]	Single Cell Type RNA - Suprabasal keratinocytes [NX]	Single Cell Type RNA - Syncytiotrophoblasts [NX]	Single Cell Type RNA - T-cells [NX]	Single Cell Type RNA - Undifferentiated cells [NX]	Single Cell Type RNA - Urothelial cells [NX]	RNAsingleCellTypeSpecific
CACNA1G	Cav3.1, NBR13	ENSG00000006283	Calcium voltage-gated channel subunit alpha1 G	O43497	17	50561068-50627474	Disease related genes, FDA approved drug targets, Plasma proteins, Predicted membrane proteins, Voltage-gated ion channels	Calcium transport, Ion transport, Transport	Calcium channel, Ion channel, Voltage-gated channel	Disease mutation, FDA approved drug targets, Neurodegeneration, Spinocerebellar ataxia	Evidence at protein level	Evidence at transcript level	Evidence at protein level	Evidence at protein level	Evidence at protein level	Tissue enhanced	Detected in many		brain: 22.8;cervix, uterine: 13.6	Cell type enriched	Detected in some	26	Bipolar cells: 147.6	Low cancer specificity	Detected in some			Low region specificity	Detected in all			Low cell type specificity	Detected in some			Low lineage specificity	Detected in many			Cell line enhanced	Detected in some		A549: 13.4;GAMG: 5.0;HeLa: 4.6	Low region specificity	Detected in all			Low region specificity	Detected in all			HPA004714	Uncertain											HPA004714: AB_1078368	unprognostic (1.90e-2)	unprognostic (5.83e-2)	unprognostic (2.85e-2)	unprognostic (1.08e-1)	unprognostic (4.00e-1)	unprognostic (9.89e-2)	unprognostic (1.47e-2)	unprognostic (2.73e-1)	unprognostic (1.02e-4)	unprognostic (1.47e-2)	unprognostic (2.16e-2)	unprognostic (9.76e-2)	unprognostic (4.87e-12)	unprognostic (3.34e-2)	unprognostic (1.62e-1)	unprognostic (1.56e-3)	unprognostic (6.63e-2)	1.7	1	3.5	0.9	5.2	1.3	2.1	22.8	17.1	13.6	1	2.7	0	0.9	7.4	1	1.6	5.7	1.2	3.8	2.4	8.8	0.7	1.1	0.9	1.2	5.3	7.9	7.1	0.6	0.6	0.4	1.4	6.1	2.5	0.8	4.3	1.1	1.6	0.8	3.9	0.8	2.1	5.9	0.9	0.9	1.7	2.3	0	1.2	0	1	1	3.9	1.3	1.3	2.7	0.8	0.7	1.4	0	0	13.4	3.1	3.5	0.9	0.1	0.2	0.1	0	0.1	0.2	2.8	0.5	0	1	0.1	5	0.5	1.6	0	0.3	1.8	0.6	0.9	4.6	0.7	0.1	0.2	0.3	0.1	0	0	0	0.8	0	0.1	0	0.2	0.1	0.7	0	0	1.2	1	0.8	1.4	1.1	0	0	0.2	4.1	1.8	2.8	0.1	0	2.4	0.2	0.1	0.3	1.4	3.9	0.5	0.1	1	0.1	0	0.6	0.1	0.5	0.5	0.8	0.6	1.4	0.4	0.7	0.8	0.7	0.8	0.2	1.3	0.9	1	2.7	0.7	0.4	1.3	0.5	0	3.5	5.2	22.8	17.1	2.4	8.8	5.3	7.9	6.1	2.3	0	0	0	0.1	1.6	147.6	4.1	0	0	0	0	0	0	0	0	1.4	0	0	0	0	0.3	3.6	0.4	0	0	0.4	4.8	0	0	0	0	0	0	3.3	0	0	1.8	0	0	0	0	5.7	0	3.6	0.3	0.2	2.5	0.1	0	0	0	Bipolar cells
GABRA1	EJM5	ENSG00000022355	Gamma-aminobutyric acid type A receptor alpha1 subunit	P14867	5	161847063-161899981	Disease related genes, FDA approved drug targets, Predicted intracellular proteins, Predicted membrane proteins, Transporters	Ion transport, Transport	Chloride channel, Ion channel, Ligand-gated ion channel, Receptor	Disease mutation, Epilepsy, FDA approved drug targets	Evidence at protein level	Evidence at protein level	Evidence at protein level	Evidence at protein level	Evidence at protein level	Tissue enriched	Detected in many	22	brain: 58.6	Cell type enriched	Detected in some	24	Bipolar cells: 209.5	Cancer enriched	Detected in single	5	glioma: 1.1	Low region specificity	Detected in many			Not detected	Not detected			Not detected	Not detected			Cell line enhanced	Detected in some		HEL: 3.7;SCLC-21H: 1.1;U-2 OS: 1.6;U-87 MG: 2.3;WM-115: 1.2	Low region specificity	Detected in all			Low region specificity	Detected in all			CAB022502, HPA029363, HPA055746	Enhanced	Supported	Approved	Nucleoplasm,Plasma membrane						Plasma membrane	Nucleoplasm	CAB022502: , HPA029363: , HPA055746: AB_2682904					unprognostic (2.58e-2)						unprognostic (4.78e-3)	unprognostic (1.84e-1)		unprognostic (3.31e-1)		unprognostic (2.43e-1)		1	2.6	8.5	1	21.9	1	1	35.2	58.6	1	1	1.8	0	1.1	1	1	1	1	1	1	10.5	8.8	1	1	1	1	6.7	22	1	1	1	0.1	1	7.4	1.2	1	0.2	1	1.1	1	1	1	1	1.3	1.1	1.5	1.1	0	0	1	0	1.3	1	0.1	0	0	0	0	0	0	0	0	0	0	0	0	0	0	0	0	0	0	0	0	0	0	0	0	0.8	0	0	0	0	0	3.7	0.2	0.1	0	0	0.1	0	0	0	0	0	0	0	0	0.3	0	0	0	0.1	0.9	0	0	0	0	0	0	0	1.1	0	0	0	0	0	0	0	0	0	1.6	0.1	0	0.1	0	0	2.3	0	1.2	0	0	0	0	0	0	0	0	0	0	0	0	0	0	0	0	0	0	0	8.5	21.9	35.2	49.8	10.5	8.8	6.7	22	7.4	0	0	0	0	0	0	209.5	0.5	0	0	0	0	0	0	0	0	2.4	0	0	0	0	0	0	0.2	0	0	0	7.9	0	0	0	0	0	0	0	0	0	2.9	0	0	0	0	8.9	0	0	0	0	0	0	0	0	0	Bipolar cells
CAMK2B	CAM2, CAMK2, CAMKB	ENSG00000058404	Calcium/calmodulin dependent protein kinase II beta	Q13554	7	44217150-44334577	Enzymes, Plasma proteins, Predicted intracellular proteins, Predicted membrane proteins	Differentiation, Neurogenesis	Actin-binding, Calmodulin-binding, Developmental protein, Kinase, Serine/threonine-protein kinase, Transferase	Mental retardation	Evidence at protein level	Evidence at protein level	Evidence at protein level	Evidence at protein level	Evidence at protein level	Tissue enhanced	Detected in many		brain: 81.9;heart muscle: 39.2;skeletal muscle: 70.7	Cell type enriched	Detected in many	11	Bipolar cells: 838.1	Low cancer specificity	Detected in many			Low region specificity	Detected in all			Low cell type specificity	Detected in many			Low lineage specificity	Detected in all			Cell line enriched	Detected in some	8	SCLC-21H: 42.0	Low region specificity	Detected in all			Low region specificity	Detected in all			CAB006849, HPA026307, HPA051783, HPA051785, HPA053973	Enhanced	Supported	Supported	Plasma membrane,Cell Junctions,Cytosol					680000	Plasma membrane	Cell Junctions, Cytosol	CAB006849: , HPA026307: AB_1845941, HPA051783: AB_2681608, HPA051785: AB_2681609, HPA053973: AB_2682328	unprognostic (1.88e-3)	unprognostic (4.49e-2)	unprognostic (3.55e-3)	unprognostic (1.36e-2)	unprognostic (5.25e-2)	unprognostic (2.90e-2)	unprognostic (8.78e-2)	unprognostic (1.09e-1)	unprognostic (1.44e-1)	unprognostic (2.71e-1)	unprognostic (1.17e-2)	unprognostic (1.60e-2)	unprognostic (5.23e-7)	unprognostic (7.04e-2)	unprognostic (2.34e-1)	unprognostic (3.15e-2)	unprognostic (3.95e-2)	1.4	8.1	20.6	1.4	46.7	1.2	2	60.1	81.9	1.2	1.4	4	0.7	1.7	1.3	18.8	2	1.8	1.2	39.2	36.5	18	1.7	3.5	1.2	1.8	10.3	21.3	1.1	3.3	5.6	9.9	1.1	13.4	3	1.4	2.7	1.8	2.2	70.7	1.8	1.6	1.2	4.1	1.3	2.4	2.3	4.8	0	7.7	2.4	2	1.1	0	1.3	1	3.2	1.2	3.2	1.2	0.8	0	0.3	0.2	0.3	0	0.2	0.2	0.1	0	0.1	0	0.1	0.1	0.1	0.9	0.2	0.1	0.1	0.2	0.8	0	1.1	2.4	0	0.1	0.1	0	0	0.5	0	0	0	0.3	0.1	0	0	0	0.4	0	5.3	0	0.2	0.1	0	2.4	0.1	0.9	0.1	0	0	42	2.2	0.2	0	0	0.1	1.9	0.2	0.2	0.2	0.4	0.2	0	0.5	0.4	0.1	0.2	0	0.2	3.2	0.7	1	0.8	0.9	1.2	1.1	1	0.5	0.5	1.3	1.2	1.1	2	3.2	1.2	1	0.9	0.8	20.6	46.7	60.1	42.4	36.5	18	10.3	21.3	13.4	4.8	0	0	0	27.8	1	838.1	74.9	2.5	0	0	0	43.2	0	8.3	0	0.8	0.6	0	0	0	0.1	0.4	2.6	4.6	4.4	0.2	57.2	39	0	1.2	2.1	1.7	0	1.7	0	0	14.1	0.1	0	0	0.8	46.7	0	0.9	0	1.7	0.4	0.2	0	0	0.7	Bipolar cells
CACNA1I	Cav3.3	ENSG00000100346	Calcium voltage-gated channel subunit alpha1 I	Q9P0X4	22	39570753-39689737	FDA approved drug targets, Plasma proteins, Predicted membrane proteins, Voltage-gated ion channels	Calcium transport, Ion transport, Transport	Calcium channel, Ion channel, Voltage-gated channel	FDA approved drug targets	Evidence at protein level	Evidence at transcript level	Evidence at protein level	Evidence at protein level		Tissue enhanced	Detected in some		adrenal gland: 4.6;brain: 8.1;lymphoid tissue: 4.3;thyroid gland: 4.1	Cell type enriched	Detected in some	6	Bipolar cells: 18.4	Cancer enhanced	Detected in single		thyroid cancer: 2.1					Cell type enhanced	Detected in some		naive CD4 T-cell: 1.9	Lineage enriched	Detected in single	20	T-cells: 1.9	Cell line enhanced	Detected in some		JURKAT: 1.2;SK-BR-3: 6.1;T-47d: 3.6	Low region specificity	Detected in all			Low region specificity	Detected in all																unprognostic (3.97e-2)	unprognostic (1.42e-1)	unprognostic (1.02e-1)	unprognostic (4.60e-2)	unprognostic (3.52e-2)	unprognostic (1.58e-1)	unprognostic (1.19e-1)	unprognostic (2.63e-1)	unprognostic (7.21e-2)	unprognostic (5.20e-3)	unprognostic (1.64e-2)	unprognostic (8.64e-2)	unprognostic (1.62e-2)	unprognostic (6.14e-3)	unprognostic (1.57e-1)	unprognostic (3.78e-2)	unprognostic (8.27e-4)	0	4.6	3.4	1.9	5.8	1.3	0.2	8.1	7.5	0	0.2			0.2	0	0	0.1	0	0.4	0	5	3.6	0	0	0.2	4.3	0.7		0	0	0	0	0		0	0.1		0	0	0	0.1	0.9	0	0.4	1.3	0.5	1.1			4.1		1.2	0.6	0	0	0	0	0	0	1.9	0.1	0	0.1	0	0	0	0	0.5	0	0	0.1	0.1	0	0	0	0	0	0.8	0	0.1	0	0	0.4	0	0.1	0	0	0	0	1	0	0	0	0	0.2	0	1.2	0	0	0	0.8	0	0	0.1	0.3	0	0	0	0.3	0	0.1	0.2	0	0	6.1	0	0.4	3.6	0	0	0	0.8	0	0	0.2	0	0	0	0.5	0	0	0	0	0	0	0.3	0	1.2	0.5	0	0	1.9	0.7	0	0	0	0	0.8	0.1											0	0	0	0	0	18.4	2.5	0	0	0	0	0	0	0	0	0.7	0	0	0	0	0	0	0	0	0	0	3.2	0	0	0.3	0	0	0	0	0	0	2.1	0	0	0	0	0.2	0	0	0	0.1	0	0	0	0	0	Bipolar cells
SLC8A3	NCX3	ENSG00000100678	Solute carrier family 8 member A3	P57103	14	70044217-70189070	Predicted membrane proteins, Transporters	Antiport, Calcium transport, Ion transport, Sodium transport, Transport	Calmodulin-binding		Evidence at protein level	Evidence at transcript level	Evidence at protein level	Evidence at protein level	Evidence at protein level	Group enriched	Detected in many	5	brain: 17.0;skeletal muscle: 32.1	Cell type enriched	Detected in some	4	Bipolar cells: 33.9	Cancer enriched	Detected in single	8	glioma: 1.4	Low region specificity	Detected in all			Not detected	Not detected			Not detected	Not detected			Cell line enhanced	Detected in some		AF22: 4.0;LHCN-M2: 7.3;SH-SY5Y: 23.9	Low region specificity	Detected in all			Low region specificity	Detected in all																unprognostic (1.65e-1)	unprognostic (5.53e-2)	unprognostic (1.18e-2)	unprognostic (1.51e-2)	unprognostic (2.41e-1)	unprognostic (1.95e-1)	unprognostic (1.69e-1)	unprognostic (3.46e-3)	unprognostic (4.74e-2)	unprognostic (1.64e-1)	unprognostic (1.45e-3)	unprognostic (8.53e-2)	unprognostic (5.86e-2)	unprognostic (1.14e-3)	unprognostic (1.48e-1)	unprognostic (1.48e-1)	unprognostic (3.38e-1)	0.7	2.8	6.1	1.2	6.1	1	0.9	3.8	17	1.4	1.1	3.1	0	1.1	0.9	1	1.1	0.7	1.3	1.5	5.8	8.2	0.6	0.6	1.6	1	4.7	7.1	0.6	1	0.6	1.5	0.7	6.4	1.2	1.1	1.5	0.6	0.8	32.1	0.8	1.2	1.2	2.8	0.7	1.2	0.8	1.9	0	0.6	4.9	0.9	1	0.3	0	0	0	0	0	0	0.7	0	0	4	0	0	0	0.7	0	0	0	0	0	0	0	0	0	0	0	0	0	0	0	0	0.6	0.5	0	0	0	0	0.1	0	0	0	0	0	0	0	0	7.3	0	0	0	0	0	0	0	1.8	0	0	0	0	23.9	0.1	0.2	0	0	0	0	0	0	0	0	0	0.2	0	0	0.1	0	0	0	0	0	0	0	0	0	0	0	0	0	0	0	0	0	0	0	0	0.7	6.1	6.1	3.8	10.6	5.8	8.2	4.7	7.1	6.4	1.9	0	1.1	0	0	0.1	33.9	1.1	0	0	0	0	3.9	0	0	0	0.3	0	0	0	0	0.1	0.2	0	8.1	0	0.1	7.9	0	0	0	0	0	0	0	0	0	0.9	0	0	0	0	1	0	0	0	0	0	0	0	0	0	Bipolar cells
VSX1	PPCD, PPCD1, PPD	ENSG00000100987	Visual system homeobox 1	Q9NZR4	20	25070885-25082365	Disease related genes, Predicted intracellular proteins, Transcription factors	Sensory transduction, Transcription, Transcription regulation, Vision	Developmental protein, DNA-binding	Corneal dystrophy, Disease mutation	Evidence at protein level	Evidence at transcript level	Evidence at protein level	Evidence at protein level		Group enriched	Detected in some	4	brain: 17.0;retina: 20.7	Cell type enriched	Detected in some	20	Bipolar cells: 345.7	Not detected	Not detected			Region enriched	Detected in many	7	cerebellum: 17.0	Low cell type specificity	Detected in some			Low lineage specificity	Detected in many			Cell line enriched	Detected in some	5	Karpas-707: 9.9	Not detected	Not detected			Not detected	Not detected																unprognostic (1.93e-1)	unprognostic (6.63e-2)		unprognostic (9.68e-3)	unprognostic (4.33e-2)		unprognostic (2.27e-1)	unprognostic (1.97e-1)	unprognostic (4.01e-1)	unprognostic (8.64e-3)	unprognostic (2.70e-2)	unprognostic (1.35e-1)	unprognostic (2.31e-9)	unprognostic (1.53e-2)	unprognostic (2.35e-1)	unprognostic (3.07e-4)	unprognostic (2.38e-1)	0.4	3	2.3	0.4	1.6	1.6	0.4	17	2.8	0.4	0.4	0.4	0.4	0.1	1	0.4	0.4	0.4	0.4	0.5	1.9	2.1	0.4	0.4	0.4	0.4	2.1	0.4	4.6	1.2	1.1	2.7	0.4	0.5	0.5	0.1	20.7	0.4	1	1	0.6	0.5	0.4	1.5	0.4	0.3	0.7	0.4	0.4	0.7	0.4	0.4	0.4	0.4	1	1.5	2.4	0.3	1.3	0.6	0.1	0.1	1.5	0.2	0.2	0	0	0.2	0	0	0	0	0	0.2	0.2	0.2	0	1.8	0.2	0	0	0	0.3	0.2	0.1	0.4	0.3	0	0.3	0.1	0	0	0.1	0	0.2	0	0.9	0	9.9	0	0.2	0	0	0.1	0	0.3	0.1	0.1	0	0	0.2	0.5	0.1	0	0.3	0	0.2	0.8	0.3	0.1	0.3	0	0.1	0	0.3	0	0.3	1	0.1	0.1	2.4	0.3	0.3	0.6	0.3	0.5	0.7	0.4	0.3	0	1	0.4	0.5	2.1	1.3	0.2	1.5	0.1	0.1	2.3	1.6	17	1.4	1.9	2.1	2.1	0.4	0.5	0.4	0	0	0	0	0	345.7	1.2	0	0	0	0	3.9	0	0	0	0.2	0	0	0	0	0	0	0	0	0	0	3.2	0	0	0	0	0.3	0	0	0	0	4.3	0.1	0	0	0	16.9	0	0	0.1	0.5	0	0	0	0	0	Bipolar cells
GABRR2		ENSG00000111886	Gamma-aminobutyric acid type A receptor rho2 subunit	P28476	6	89257208-89315299	FDA approved drug targets, Predicted membrane proteins	Ion transport, Transport	Chloride channel, Ion channel	FDA approved drug targets	Evidence at transcript level	Evidence at transcript level	Evidence at transcript level	Evidence at transcript level		Tissue enriched	Detected in some	12	retina: 18.8	Cell type enriched	Detected in some	13	Bipolar cells: 19.8	Not detected	Not detected			Not detected	Not detected			Cell type enhanced	Detected in single		plasmacytoid DC: 1.0	Lineage enhanced	Detected in single		dendritic cells: 1.0	Cell line enhanced	Detected in some		U-266/70: 4.4;U-266/84: 1.6	Low region specificity	Detected in single			Low region specificity	Detected in many																unprognostic (2.05e-2)	unprognostic (1.47e-4)	unprognostic (1.56e-1)	unprognostic (1.88e-4)	unprognostic (4.19e-1)	unprognostic (1.07e-1)	unprognostic (2.24e-2)	unprognostic (9.13e-2)	unprognostic (2.87e-1)	unprognostic (1.10e-2)	unprognostic (2.65e-1)	unprognostic (1.41e-1)	unprognostic (1.54e-6)	unprognostic (3.69e-2)	unprognostic (7.81e-2)	unprognostic (5.79e-2)	unprognostic (7.15e-3)	0.2	0.6	0.2	0.5	0.4	0.3	0.1	0.3	0.4	0.1	0.1	0.1	0.1	0	0.7	0.5	0.2	0.1	0.4	0.2	0.3	0.2	0.3	0.4	0.1	0.9	0.3	0.1	0.1	0.8	0	0.2	0.1	0.1	0.3	0	18.8	0.6	0.2	1.5	0.5	0.1	0.1	0.2	0.4	0.1	0.6	0.1	0.1	0.5	0.1	0.1	0.1	0.1	0.3	1	0	0	0	0.1	0.1	0	0.6	0	0.4	0.5	0	0	0	0.1	0	0.2	0	0.3	0.6	0.3	0.2	0.1	0.1	0	0	0.1	0	0.4	0.3	0	0	0.2	0	0	0.2	0.1	0	0	0	0	0.2	0.1	0.6	0	0.2	0.2	0	0	0	0.2	0.9	0.4	0	0.3	0.1	0	0	0	0.1	0	0	0.1	1	0	0.4	0	0	0	4.4	1.6	0	0.5	0.4	0.3	0	0	0	0	0	0	0	0.1	0	0	0.3	0	0	0	0	0	1	0	0.1	0.2	0.4	0.3	0.3	0.3	0.2	0.3	0.1	0.1	0.1	0	0	0	0	0	19.8	0.3	0	0	0	0	0	0	0	0	0.9	0	0	0	0	0	0	0	0	0	0	1.6	0	0	0	0.4	0	0	0	0	0	0	0.1	0	0	0	0.3	0	0	0	0	0	0	0	0	0	Bipolar cells
GRM6	CSNB1B, GPRC1F, mGlu6, MGLUR6	ENSG00000113262	Glutamate metabotropic receptor 6	O15303	5	178978327-178996206	Disease related genes, G-protein coupled receptors, Potential drug targets, Predicted membrane proteins	Sensory transduction, Vision	G-protein coupled receptor, Receptor, Transducer	Congenital stationary night blindness, Disease mutation	Evidence at protein level	Evidence at protein level	Evidence at protein level	Evidence at protein level	Evidence at protein level	Tissue enriched	Detected in some	8	retina: 22.0	Cell type enriched	Detected in some	31	Bipolar cells: 422.6	Not detected	Not detected			Low region specificity	Detected in some			Low cell type specificity	Detected in some			Low lineage specificity	Detected in many			Low cell line specificity	Detected in some			Not detected	Not detected			Not detected	Not detected			HPA014511	Enhanced											HPA014511: AB_2669025	unprognostic (1.85e-1)	unprognostic (1.54e-1)	unprognostic (8.41e-2)	unprognostic (1.27e-1)	unprognostic (4.16e-1)	unprognostic (2.25e-3)	unprognostic (7.72e-2)	unprognostic (2.32e-2)	unprognostic (2.12e-3)	unprognostic (6.27e-2)	unprognostic (3.34e-4)	unprognostic (2.58e-1)	unprognostic (3.36e-4)	unprognostic (1.23e-1)	unprognostic (6.45e-2)	unprognostic (7.59e-3)	unprognostic (1.97e-1)	0.3	0.5	0.6	0.4	0.6	1.6	0.3	1.9	1.6	0.4	0.4	0.3	0.3	0.3	0.6	0.5	0.3	0.5	0.7	0.4	0.5	1.2	0.4	0.4	0.4	0.5	0.8	0.3	0.7	0.9	0.1	2.9	0.3	1.2	1.1	0.1	22	0.6	0.3	1.3	1.8	0.3	0.3	0.3	0.5	0.3	2.2	0.3	0.3	0.9	0.3	0.3	0.3	0.3	0.9	1.1	2.4	0.4	0.6	0.6	0.1	0.5	0.3	0.7	1.3	0.3	0.1	0.7	0.2	0	0.1	0	0.5	0.9	0.9	0.6	0	0.6	0.7	0	0.1	0	0.2	0.7	0.5	0.7	1	0.2	0.8	1	0.1	0.3	0.1	0.5	0.3	0	0.9	0.9	1.7	0	1	0.2	0.8	0.6	0.5	0.6	0.6	0.3	0.8	0.1	0.6	0.9	1.2	0.5	0.7	0.5	1.1	0.9	1.1	0.9	0.5	0.5	0.4	0.5	0.7	0.6	0.4	0.4	0.7	0.3	1.9	0.4	0.5	0.6	0.3	0.4	0.4	0.4	0.3	0.2	0.9	0.4	0.4	2.4	0.6	0.2	1.1	0.2	0.1	0.6	0.6	1.9	0.5	0.5	1.2	0.8	0.3	1.2	0.3	0	0.3	0	0.1	0.3	422.6	1.4	0	0	0	0	2	0	0	0	0.8	0.5	0	0	0	0	0	0.3	0	0	0.1	3.2	0	0	0	0.9	0	0.2	0	1	0	3.7	0.1	0	0	0	13.7	0	0	0.5	0	0	0.1	0	0	0.1	Bipolar cells
